<?xml version="1.0" encoding="UTF-8"?>
<!--Sample XML file generated by XMLSpy v2006 rel. 3 sp1 (http://www.altova.com)-->
<crewMessage xmlns:xsi="http://www.w3.org/2001/XMLSchema-instance" xsi:noNamespaceSchemaLocation="../crewVacationTradeSnapshot.xsd" version="1.00">
	<messageName>CrewVacationTradeSnapshot</messageName>
	<messageBody>
		<crewVacationTradeSnapshot version="1.00">
			<crew>
				<crewId>34567</crewId>
				<vacGrps>
					<vacGrp>
						<name>VG12</name>
						<startDate>1967-08-13</startDate>
						<endDate>1997-08-13</endDate>
						<vacActs>
						</vacActs>
					</vacGrp>
					<vacGrp>
						<name>VG34</name>
						<startDate>1997-08-13</startDate>
						<endDate>2099-08-13</endDate>
						<vacActs>
							<vacAct>
								<taskCode>VA</taskCode>
								<std>2005-12-07T23:00:00</std>
								<sta>2005-12-17T23:00:00</sta>
							</vacAct>
							<vacAct>
								<taskCode>VA</taskCode>
								<std>2006-02-14T23:00:00</std>
								<sta>2006-02-17T23:00:00</sta>
							</vacAct>
						</vacActs>
					</vacGrp>
				</vacGrps>
			</crew>
			<crew>
				<crewId>86754</crewId>
				<vacGrps>
					<vacGrp>
						<name>String</name>
						<startDate>1967-08-13</startDate>
						<endDate>2099-08-13</endDate>
						<vacActs>
						</vacActs>
					</vacGrp>
				</vacGrps>
			</crew>
		</crewVacationTradeSnapshot>
	</messageBody>
</crewMessage>
